text,is_spoiler,source,mal_id,timestamp
"One Piece Movie 1: (2000) Review Story (6/10) Fair The story is fine and simple for an anime movie is was fine and entertaining nothing more to be said he. Art and Animation (9/10) GreatSeeing that this movie came out about 16 years ago, I say that the art style and animation is definitely great not even the first couple hundreds of episodes of the actually anime look this nice and that's usually the case when you make a movie. This one movie even had a classical 90s feel and animation to it which I liked alot.


Sound (9/10) Great

The sound is great and I've been watching the Funimation Dub of the anime this whole time so this is technically the first thing I've watch from One Piece that is in JP and the JP voice actors for everyone sound great. 

Characters (9/10) Great 

Your default straw hat crew before they got Sanji is all here and doing their thing and they are just as entertaining as they always are. The movie characters were ok which is why I can't give this section a 10 because they weren't that interesting but nonetheless nobody was bad in my opinion


Enjoyment (7/10) Good

Now these days I can't sit down and finish a movie in one sitting so my enjoyment reached at least a 7 because of the straw hat crew acting like how they always do and making it and enjoyable and entertaining ride through the entire movie.


Overall (8/10) Very Good

I think for an anime movie this is a really good first movie and usually when it comes to anime, their first movies are usually like this it's the ones after it that usually are not that good we'll see how that turns out because I'll try to review all of them this one I have to give an 8 because I enjoyed the 90s art style presentation more than anything when it came to this movie.",False,anime_review,459,2016-01-15T15:29:00+00:00
"""The thing I devoted my entire life to, it wasn't the gold. It was the adventure to find the gold."" There's always a sense that a movie based on an anime series is going to be a throw-away story that only ends up being a cheaper version of its roots. As someone who has only watched about 50 episodes of the anime series so far, but is really getting into it, I think that does to some extent apply to this film, but I still think it's a pretty good One Piece movie, even though the title ""One Piece: The Movie"" is a bit too bigfor it.

It's another chance to see the characters be themselves, and although not asdetailed as the series, I think it represents the fun and adventure well enough. The new characters of Tobio and Ganzo are simple, but endearing, and I really like the resolution they come to in the end and how they both learn to respect each other more. I feel that it's easy in a film to have only the child or parent (grand-parent in this case,) learn respect for the other, but in this case it applies to both, and the ending is actually kind of heartwarming.

The film is pretty short, only clocking in at 51 minutes, including the credits and the opening song (the latter of which I would have been perfectly happy hearing in the beginning of all of the over 800 episodes of the series), but I think it's the perfect length for this series. Any longer and it would probably have dragged on. With this limited amount of time, the comedy is also a lot more fast-paced, and I think that generally works in its favor. The humor is crazy and full of personality, much the like the series, and most of it works very well. Heck, I even enjoyed how Luffy and Zoro are chained together for a decently big part of the film, and have to find out ways to keep progressing through the story while being in that state, leading to some creative moments.

I do have some problems. Two of them to be exact. For one, the flashback and backstory feel a bit rushed. One Piece is usually pretty good with its flashbacks, showing characters changed into what they are now, and how their current situations came to be. It's also very good at changing the character designs to look younger, but still recognizable, even when the flashback only goes a few years back. In this film, the characters certainly look younger, but all of the explaining is done through shouted exposition, which just isn't that engaging. It's a shame too, because otherwise their development is pretty decent.

The second problem I have is that the antagonist, El Drago, is phenomenally uninteresting. His very specific obsession with gold, (to the point where he doesn't even care about gems, only gold,) is never detailed or explained, and doesn't lead to anything at all in the end. I think the least they could have done would be come up with a funny reason for why he was so obsessed with gold and only gold, and otherwise there's not much to his personality. Even his special ability is a bit too basic, as it's pretty much just using his yelling to destroy things like the Dovahkin, (at least someone in One Piece found a use for their excessive screaming). It's a funny idea, but it's not used in a particularly creative way or build upon at all, except for a pretty humorous way for Luffy to defeat him towards the end. (It didn't make sense, but shut up, it was funny!)

But to be fair, the El Drago really wasn't the focus of the story, Tobio, Ganzo and the (supposedly) legendary pirate Woonan were, and I think their arcs were all basic, but still pretty engaging. The movie wasn't fantastic, but for what it is, it's likable, a decent amount of fun, and represents the personality of the series decently well. It's some more of One Piece to enjoy.

You know... if you didn't have enough of it already...",False,anime_review,459,2018-01-26T04:12:00+00:00
One Piece 2000 was most likely in production before many of the anime's early episodes. This film was created using the traditional animation process of cels and paint. This movie had a bland story which probably won't be valued by viewers outside of the One Piece fandom. The art was...appropriate. I don't feel like anything was missing. This film had some of my favorite music pieces. The sounds were fine. The characters were themselves and most of the enjoyment came from this paired with the great music. This half-feature is best suited for One Piece anime viewers and people who want anime under their belts.,False,anime_review,459,2012-07-01T15:56:00+00:00
"The main strong point of this movie is its style, common to the anime series, so when you watch it you're almost ready to believe that this is one more canon adventure of the Straw Hat crew (unfortunately, that feature is not usual for One Piece movies). And the main message of this movie - that money and gold are not the right things to value - is seen here as clearly as in the early episodes of One Piece (Orange Town arc, for example). If you expect the movie to be like a continue of the original story - you won't be disappointed",False,anime_review,459,2013-04-03T10:04:00+00:00
"Absolutely loved this. Was sorta debating if the older One Piece movies would be good and so far with this one, they are. If you miss the old art style/animation watch this NOW!!! was actually like a time capsule So many good scenes with everyone I loved it Its nice seeing Luffy, Zoro, Nami, and Usopp just being goofy again, all the pre timeskip humor and stuff is there. Especially Luffy running on 1 brain cell the entire time lmfao I love the characters in this movie too, they are all silly, even the bad guys. Loved all of Usoppsstuff, bro was like the smartest one in the room this movie LMAO    ....  or the villains are just really REALLY stupid.   Even thought it was short, the Ganzo and Woonan backstory was really nice 

Loved the ending of the movie, the final fight was nice and I loved how they ended the story.

Cherry on top was that they played We Are at the start of the movie 😭 AND THEN MEMORIES AT THE END ARGHHHH  😭😭😭   Actually surprised me so much    have no idea why they played it but thank you

WATCH THE MOVIE!!! I RECOMMEND IT!!!!!  also  WATCH THE END CREDITS  THEY HAVE COLORED COVER STORIES",False,anime_review,459,2024-05-04T14:10:00+00:00
"One Piece Movie 1 Review By: Eiichiro Oda August 5, 2019 The first movie is where there's still only 3 crew along Luffy's. On their journey, they come across another crew of El Drago which is currently searching for the treasure of Great Gold Pirate Woonan. With the treasure map on their hands, they are on their way to this riches. On the other hand, Luffy and his nakama's been starving to death when three of El Drago's crew steal Nami's gold on their ship. The story goes on with treasure hunting and gold searching, written on the map. Since it is the first movie and it iskinda old anime, the animation is not that really good. But it won't lessen the excitement watching it, given that the anime already made the name for itself. Additionally, the main recipe of the story where friendship and pride of a man take place was really great. It was a film that took one hour, seems like two episodes with just a very short but meaningful story.",False,anime_review,459,2020-01-05T15:37:00+00:00
"If I had to pick a One Piece movie from the first 5 to checkout it would be this one. It is so interesting to see what the writers thought would matter or how the world reacts to stuff in this movie since it was made while they were still in the East Blue (pre-Sanji even). The core characters feel very nostalgic and maybe even a little off since there was so little material to base off of yet. The main plot in itself is a ""we have Gold Roger at home"" thing. They make a new legendary pirate up and the straw hats try tofind his treasure. Its honestly not bad since its only 50 minutes and not the standard 90 minute movies. This shorter time does mean that the main villains are just written terribly and have 5 minutes of screen time or less.

I really cant even say much more since it doesn't have much content in itself. If you love One Piece and are unsure of the movies, I would say to at least check this one out from the first 5 to see how weird it feels.",False,anime_review,459,2025-08-19T03:24:00+00:00
"Man, what a beautiful movie. It's the pure essence of what the author wants to tell us about the values of friendship, adventures, and everything else you can imagine. It's really worth watching not only the whole anime, but also the ovas and all the movies, to add great values and lessons to our lives. Definitely the best thing I did was stop to watch each one piece movie, I'm already looking forward to watching the others. Watch One Piece my dears, many people give up because of the number of episodes, but I guarantee that there is no story in the world that hassuch a capacity to charm, move and make everyone fall in love",False,anime_review,459,2023-01-05T18:01:00+00:00
"Okay, so if you haven't watched the very anime of one piece, I suggest not watching this first. And if you had already, I recommend watching! This was my first one piece movie and to be honest, I wasn't expecting a lot since it's a movie and is non-canon. But 5 minutes into the movie, I was already laughing so hard. The comedy here is really gold. The very plot of the movie is kind of vague but is decent. I even cried a bit at some parts even though the plot wasn't really complex. Story: 7 (Not that deep but is executed well) Art: 10 (Oldart style of one piece, it feels very nostalgic + pre-time skip designs)

Sound: 10 (The usual one piece sound and We Are as the opening and.. MEMORIES AS THE ENDING SONG so be prepared to be emotional at the end)

Character: 10 (Of course, the OG: Luffy, Zoro, Nami &amp; Usopp are here. Kind of sad that sanji isn't here but :D)

Enjoyment: 10 (If you love one piece then you'll also love this movie. I enjoyed it a lot but really emotional at the end)

Overall: 10 (When you watch this, you'll feel really proud of what luffy has been accomplishing recently. This movie was done even before the straw hats have entered the grandline. You'll surely appreciate this movie especially now that luffy is currently going 1V1 with kaido at wano. Plus the straw hats' friendship especially zoro and luffy &lt;3)",False,anime_review,459,2021-11-12T08:54:00+00:00
"I've only recently started One Piece and decided to watch all the movies along with the anime-- as best to the place where they fit in as I can. This first one was okay. Like, there was nothing about it that was really bad... But there was nothing impressive about it either. I wouldn't say the whole ""personal connections/ambitions/whatever else is more valuable than material things"" lesson was a bad moral to go with, necessarily. Interesting choice for an anime centered around pirates. But even that isn't super worth analyzing, because 20 episodes is still deep enough in for me to know by now thatLuffy isn't your average pirate. 

I guess my point is, I went through all the Naruto movies as well, and there were certainly some rough patches there. But sometimes, the rest of the movie being extra fun or lighthearted can make up for a weak story, and I'm not sure I'd even describe this one as that sort of standalone anime movie. It probably would have been better off if it was just shortened into a filler episode. I kind of would have expected the very first movie to have some weight behind it, but this really didn't. Makes it a little easier to understand why I had to go wading through pirate sites to even find a place to watch it. (I couldn't believe something One Piece related had never been officially licensed. Like, if One Piece hasn't been successful enough to get the whole sweep, what is?!) 

You know what? There was one moment that sticks out in a positive way. I really liked seeing the final fight, where Luffy showcases every single one of his Gum-Gum moves that the anime's shown so far. He's got a bit more fighting versatility than I give him credit for sometimes. So that was neat.",False,anime_review,459,2021-11-22T11:34:00+00:00
"Which Way Goes The Tail? One Piece movie 1 is a Fun Adventure form the more simple One piece Days. Movie 1 feels like one of the more fun filler episodes of the show, where we have clean and strong fights, fun slapstick. And it hits on the normal themes of the show, like dreams and bad pirates being greedy bastard. But it's done well, so it's not annoying. but where anime shines in the animation, it looks good, It has some smooth fighting, it has that nice cell animation looks, and you can truly feel it is the Dragon Ball movie team that is animating the fights.One of the joys about watching the one piece movies and the Dragon Ball movies, is you get to see the characters in certain power levels, just have fun Adventures that they didn't get to in the main series, and this movie you get that feeling, and that's why I will recommend it.",False,anime_review,459,2025-05-04T00:59:00+00:00
"ARITAKE NO YUME WO KAKIATSUME~~~ SAGASHIMONO WO SAGASHI NI YUKU NO SA~~~ I'm sorry, someone tripped and said ""One Piece THE Movie"". This is a distillation of everything the series is about into a (kinda) tight 60 minutes. It's very funny. There's action (that, tbh, doesn't deliver much even in the end). There's meditation on the meaning of life. There's emotionally wrought backstory told through flashback. There's spiritual victory clutched from the jaws of material victory. I mean, seriously, Woonan is a mirror universe version of Luffy, whose dream comes true only for him to realize that it may not have been exactly what he was looking forand achieving a dream ultimately means you keep on living alongside everyone else. That's such a fucking mood, man. Especially in the context of this series. So damn big brained. Wow.

Also, one of the first lines could easily be a voice training meme for our trans friends out there.",False,anime_review,459,2021-11-28T05:47:00+00:00
"Such a boring movie. It felt like three or four filler episodes crammed into one movie. Old characters are basically the same here, the art somehow looks worse than in anime at this point, main villian is laughably silly and simple, as well as his crew which are almost identical to crew from Syrop Village Arc. I'm not really fond of One Piece comedy in general, but here it was especially poor and cringeworthy. Other than formulatic but touching final with Ganzo and the last words of Woonan, all of this felt like a waste of time. At least it wasn't very long.",False,anime_review,459,2021-01-05T08:30:00+00:00
"I seriously have no idea who this was made for. I feel like it was specifically made to cater to people who have already swore off on never watching One Piece because of how long it is. And yet, those people still can't watch this as their introduction to the series, since this arc takes place in the middle of the entire series which means you still gotta watch the first 516 episodes that came before it to understand what the heck is going on. And even still, the pacing is TOO fast now to where you can barely keep up with whats on screen.Some footage looks flat out sped up, character interactions and story beats sometimes don't make sense because of context that was trimmed out, which I'm guessing they just assumed the people who've already seen this arc in full would just fill in the gaps on their own. But then that begs the question, once again. WHO WAS THIS MADE FOR!? Yes, I know this was made to give both Oda and the anime team time to prep for the final saga (which I still can't believe is finally happening) and this was just a nice extra to tide us over so we weren't without something to watch for 21 weeks. And yes, the new animation is spectacular, especially in comparison to the original episodes. But every single other thing about this edited arc was a downgrade in every single way. One Piece is long for a reason. It takes the time it needs to tell it's story. You simply have to be ok with that. Trust the process and enjoy the journey, rather than trying to look for shortcuts in getting caught up just so you can be watching something you deem to be ""relevant"". Just watch One Piece. Just try. The only thing stopping you is your own excuses. I promise you that any attempt at cutting corners in the journey will only serve to sully your overall experience. Just take a chance in starting, and keep moving at a steady pace. You'll be so much more thankful that you did.

5/10",False,anime_review,60108,2025-03-30T06:43:00+00:00
"I'm aware and that my opinion is gonna be in the minority here but I don't think this deserves a level of hate it received Sure they cut some stuff out and it 100% isn't perfect but I'd still say that all of the majorly important story stuff and all of the important actions scenes are here, It's still all mostly here just cropped a bit You should definitely still rewatch the original over this but for a rewatch if you haven't seen the Fishman island arc, This is definitely for you I'd rank this a solid 7/10 nothing groundbreaking, The animation is a bit nicer in myopinion though",False,anime_review,60108,2025-03-30T06:06:00+00:00
"One piece is just an amazing anime, no matter what arc I cry at least once. I know I don't speak for everyone but this anime will until I die hold dear to my heart. The anime always throws you for a loop and the from episode one not just this arc but the very first episode starts childish but that's the nostalgia and fun side then it ramps up and never lets go, the art is beautiful, the characters are unique, the serious moments draw you in feeling personal and making you wish you was there ( almost like a movie theater, very cinematic)the only difference between this and other shows, movie, anime, etc it doesn't draw me in like one piece. Making me forget time, and reality. I thank my creator Im able to enjoy this masterpiece and when it's over I will cry and gather the show from start to finish to pass down. 🙏",False,anime_review,60108,2025-05-20T23:11:00+00:00
"Oh boy, this 6 months break will be remembered, if not for the void us One Piece fan felt with minimal One Piece content, it would be for the fact that we were gifted a remastered version of the Fishman Island arc, in the Wano style. So many fans watered their mouths over this one when it was first announced, remastering none other than the cluster mess that was the Anime adaptation of Fishman Island, no other arcs needed a refresher more than this one. I guess, we can only get so high, huh. The remaster was NOT all roses and flowers, it started pretty hype andpromising, yes, but then, the half-baked edits were getting too frequent, hard cuts, non syncing sound cuts and way too fast pacing. yes, complain about fast pacing in One Piece, and with Fishman Island nonetheless. It was truly a bizarre case of Monkey’s paw.

This is definitely a celebratory edition not meant for first-timers, and more so for marinated old fans who are asking for more.

Overall: 7.3/10.",False,anime_review,60108,2025-04-02T14:58:00+00:00
"I'm really glad that Toei made the choice to remaster and release an abridged version of the Fishman Island arc. It was great to revisit the things that I forgot over the years and also see my favorite moments again. One thing I really appreciated about this version that by speed it up a bit, it made the pacing nicer and it got rid of the places that moved too slowly in the original version of the anime. However, there were times where things sped by a little too fast and I think maybe they need an extra episode or two to make the partsthat went a little two fast feel like they were paced better. 

That said, it still of course contained the pros and cons of the original version, but that was expected. I hope in the future we might see other longer arcs revisited in this format rather than trying to do something ""An episode of Skypiea"" that ended up making everything move so fast that it felt a little pointless and lost in the chaos. 

If you liked the Fishman's Island arc, this is worth checking out especially if it's been some years since you last watched it. If you  aren't a fan of One Piece when it starts cutting stuff for time, then you might want to skip this special revisit.",False,anime_review,60108,2025-03-30T10:48:00+00:00
"Though I had high hopes for this one, unfortunately it turned out to be quite horrible. Brainless plot, abrupt start & ending, bad use of characters, no heartfelt incidents, no meaningful turning points, dialogs that made me facepalm myself and so, so many coincidences throughout this movie. So many coincidences it's actually ridiculous. For instance, they are all on a huge freaking island and they just keep 'stumbling across' one another at the right moment. Nevertheless, the thing that ticked me off the most was that I found 0% funny scenes. Seriously, even One Piece Movie 6 had more humor and its basically a psychologicalthriller.

It seemed more like a really long One Piece commercial that a movie. ""Oh, look! We have all those cool characters in our anime. Come and watch it."" I mean they introduce a person like Bullet and he does absolutely nothing other than shout ""I strive to be the strongest!"" Sooo original! In addition, how he enters the scene is boring enough to revert your eyes from the screen. An otherwise stressful moment of Usopp being hurt by this insanely strong enemy, was ruined when it was not shown properly so that the viewer will feel fear or compassion for this long-nosed character. 

Fight animation wise it was... decent. A few fight scenes looked quite silly, but those were few and far apart. The final battle though was just awful. It was fairly alright until Bullet decided to go full Mechagodzilla style which, in my humble opinion, destroyed my already low interest in this movie.

This film could have had SO much potential (and I can't emphasize this enough!) due to the festival setting and the story of one of Roger's former crew-mates, but they managed to ruin it and create a ""stampede"" of already well known characters who begged for screen time and nothing more. Maybe this story required 2 parts and more time to do it correctly.

And all the aforementioned come from an One Piece fan that loves it since grade school. I do not know why I still keep watching this anime. Maybe it's the nostalgia, the need to know the ending or maybe just to see some random adventure of this crew. Whatever the reason, I always hope for at least a decent plot and not some unreasonable fights with gibberish dialogs like in this movie. But, alas, our beloved One Piece has already become another victim of exploitation and exists for the sole purpose of selling merchandise, video games and plot-less films. It's a shame...",False,anime_review,38234,2020-04-05T07:58:00+00:00
