text,is_spoiler,source,mal_id,timestamp
"As a die-hard One Piece fan... Obviously the animation and singing was very good but the story was kind of ass and it didn't seem that well written. So visuals and Audio score pretty high but the overall content I'm just really not feeling it. So It's good and bad at the same time, leaving it PRETTY MID. The 3D stuff was kind of goofy as well, a lot of the characters behaviors just didn't feel right and responses were weak. It felt very bland, including the fight scenes especially it felt very unnatural like ""let's show each of these characters doing a move just for the sake of it""I've cried at a lot of one piece but this didn't even come close to making me tear up. It's just very clearly not written by Oda.
Low-key feels like a kind of mediocre fan fiction. Most characters felt off and not quite used right, both their personalities and their moves. The choreography seemed pretty bad most of the time it was very linear. 
The plot twists felt more like excuses for bad writing, even the ending doesn't make a lot of sense.",False,anime_review,50410,2025-04-13T14:02:00+00:00
"Here I thought One Piece Stampede was the best One Piece Movie, or so I thought until today. Though I've to note that probably and only probably, this movie will be to the liking of most One Piece fans, so if you haven't read anything or watched anything about One Piece, then maybe it'd be pointless to watch the movie, since you probably won't understand most of the things that happen in the movie or where all the hype comes from. Anyways, I found the movie great because: -The story was compelling but sometimes lacking. I liked it overall but I thought it would be alittle more complex and a little less convenient. Nonetheless, it stands out despite being the plot of a One Piece movie, so yeah, it's pretty good.

-The characters are literally the same as in the show, but adding a few new characters and getting back another few long-since forgotten characters. Uta was more nuts than I initally thought and well, Luffy played a nice role in the movie. The rest of the Straw Hat crew were just for the show, the battles and the flashing animation so I really can't take them into account.

-The thing that stands out the most in the movie is the use of the music to bring a new level of impact to the images, I mean, the music was so loud at the theatre that I may have busted my eardrums, but anyways, the added impact was real. The music interpreted by Ado (which were used for the battles and some other scenes) were part of Uta's way of fighting, so that was quite original. Moreover, the music made those scenes more fun to watch and more impactful, I mean, it went with a whole choreography and a stunningly great animation so the music just accentuated everything that was good about those battle scenes.

-The animation was actually superb, in general terms of course. There were a few low-detailed scenes, a fair amount of CGI (not as common as I make it sound) and quite a lot of AWESOME sequences, specially towards the end and somewhere at the middle of the movie.

Overall I give it a 9/10, since as I stated before, I really enjoyed it and consider it superior to Stampede. I wholeheartedly encourage all One Piece fans/readers/viewers to watch this movie.",False,anime_review,50410,2022-11-03T15:11:00+00:00
"TLDR: the best description for this movie isn't ''an OP movie that doesn't follow the main plotline'', but ''a rave musical concert that features OP characters'' and as such, was excellent. I'm not an OP fan, but hearing this is a non-canon movie I wanted to check it out for fun. The sorta messy plot probably left people confused as there are A LOT A LOT of things happening at once and wayyy too many characters, BUT even so, this movie was such a joy. If you just relax and let yourself experience it, you will have fun. That being said, I can understand how peoplewho came here expecting an interesting story featuring a character they loved for years would feel disappointed.",False,anime_review,50410,2022-11-09T06:36:00+00:00
"It's a One Piece movie that does something different with it being more of a musical centred on the new character Uta, Shank's daughter. It's not action-heavy like previous movies. Uta herself is a complex character with clear mental issues, which is not what you usually see in One Piece. It delivers great songs, good animation and an emotional yet dark story. The last 20 minutes of this film are stellar! Don't come into this one expecting something similar to 'Strong World' or 'Film Z'. This is a unique experience for One Piece in general. I personally found it a fun watch but I understand thatthis film might be divisive for One Piece fans.",False,anime_review,50410,2023-04-30T15:58:00+00:00
"A good movie, still not as good as Film Gold and Z. The pacing felt rushed, the story felt a bit bland and entirely emotional only at the ending part. Expected more considering Stampede doesn't actually have a story but more of a character's revisit episode...and Film Red in the other hand felt like a filler episode that got a movie quality treatment. Really hope Oda could grasp back his old writing skills, as even the recent manga chapters also felt just not as impressive as the old days. Oh and in term of animation and music/soundtracks wise, this movie is a banger. Definity awatch if you prioritize this more over the story.",False,anime_review,50410,2023-03-14T09:02:00+00:00
"Best Musical Movie in a while. That being said, not the worst One Piece Movie but DEFINITELY NOT THE BEST!!! When I first watched the trailer, I got excited and hope it can really outdid One Piece Stampede as we finally be able to see Shanks in action (anime version) for like 15 years. 1 main thing to be said though, I felt like Toei or Oda tends to experiments a lot with OP movies. We got Marines POV kind of (Zero), 4 recap movies (Episodes of Skypea, Nami, Chopper, Alabasta), 1 horror (Baron Omatsuri), addition to 14 movies (including this one) with Original Plot, and with the same as most of anime movies, the events is NON-CANON. Only certain parts of the movie going to be relevant (or not) in the canon main plot. ie; Shiki from Strong World is Canon but Luffy meeting him? Never happened. Also don't know when will he be brought up again. This time around, it's Uta aka Shanks's daughter. Great character design, very good Voice Acting performances. I became a fan of Ado after watching this. Such a great songs and that's it.

The Music and OST are the only amazing/ redeemable about Film Red. Plus the hype scenes like 30 minutes at the end. Aside from that, the plot has been very slow. Uta also not a great 'villain'. Warning for OP fans who are not caught up with the manga, the scene at the end has a MAJOR spoiler that it's not out in the anime YET so be reminded. Regardless, good musical movie. Wonder what will the next genre for the next Film will be...",False,anime_review,50410,2023-03-12T04:50:00+00:00
"Well..Not the best Movie Anime, music and animation is good but... storyline just..erm ⋆ ˚｡⋆୨୧˚ Storyline: Not a canon movie, well, not the best.. Uta lore just dont make sense, in my opinion, dont make some sense. ★✮꩜⋆ Animation:WOOOOOOOO, its good actually, i like when uta sings, but idk.. the CGI on uta is good too.

.・。.・゜✭・.・✫・゜・。.

Music: 
Well.. GOOD AS FUCKKKKKKKK, ado sing as una and ADO SLAPS, but, you cant make an anime that just animation and music is good, right.

⋆⭒𓆟⋆｡˚𖦹𓆜✩⋆

Others:
Uta akuma no mi is good i guess.
Shanks is used as a bait on the movie (oh).
No one piece soul.
The movie just dont make sense like, why a japanese idol in one piece, WHYYY.

Conclusions:
""If you like disney musical you may like it""
Boring asf

5.3 of 10",False,anime_review,50410,2023-09-02T11:50:00+00:00
"Loved it!!! But its not One Piece (Let me explain). I just saw the movie in theatres and have a few things to say about it. As a currently up-to-date fan of One Piece, I can say without a doubt, that this movie was much different from the One Piece that we all know and love. You would have better chances of mixing oil and water if you try to fit this movie into the canon storyline's the tone, pacing, and overall world building. In this respect, one could say the movie fell flat. HOWEVER, as an isolated experience, I found the movie to be quiteenjoyable. Being a huge Ado fan, the music was naturally the largest part of the movie for me. Hearing the full force of the vocals and visuals being exceptionally tuned to each sequence was a really great experience (One that is even better if you see it in theatres or at least with a good audio setup). 

Furthermore, though the writing definitely has its fair share of holes, the movie overall felt like a fairly well fleshed out story within a context of a singular event. For comparison, where I found Jujutsu Kaisen 0's several month storyline to be packed quite tightly into its runtime, the 2 hour (ish) runtime of Red gave the story enough time to breathe. Though the writing was not fully representative of Oda's ability to weave together a complex, multi-arc plot-line, it told its story well enough in the time it had. 

Final Thoughts: Don't go into this movie expecting spectacular writing. There enough detail to make the plot understandable and the rest was pretty much fanservice. HOWEVER, if you are willing to set that aside, the depth of the musical score and the poppy visuals are MUCH more than enough to keep you entertained the whole time.",False,anime_review,50410,2022-11-19T21:36:00+00:00
"Sincerely? The basics to create an interesting story for me were there, but I didn't like the development of the plot, which from the beginning was too surreal (and speaking of One Piece it seems a contradiction): the origins are not fully explained (who is really, as she got the powers and origins of the so-called secondary enemy), the story seems almost a fairytale fantasy (power influences more on a spiritual level than physical), some relevant characters do not even appear (almost inconceivable, given the time span where in theory the facts take place), the ties with the 2 main characters do not seem assolid as they would like to point out (I did not notice this great friendship between them, but a simple acquaintance), and certain moments could give greater importance (final shot sequence an example, I don't want to spoil). Although it has the defects already listed above (not going into too much detail), I would like to give it a 6, because in the end for some small thing in my opinion the film is saved, music in the first place (new genesis I've been listening to it for a few weeks , but these are details😂), which has a fundamental role (even if certain moments are too ""musical"" for me); also, some events I did not mind too much, so from that side it is not disastrous. In short, it is in the list of films that you see but that you will only remember for 2 scenes at the most.",False,anime_review,50410,2022-11-08T00:56:00+00:00
"A little bit of disclaimer, this is my first One Piece film. Before released, i think there's already article or something that stated this film doesn't focus on fighting but focusing on the musical part. AND THEY'RE NAILED IT! Ado voices just too good and basically carry the film. The amount of fan service are still reasonable and a bit nostalgic i must say. But, the story itself it's kinda complicated and if you dont really pay attention to it, maybe you'll lost track of it. Overall, this movie is such a great movie that worth in every single way you can get.",False,anime_review,50410,2022-10-05T13:03:00+00:00
"My boyfriend describes this movie best, ""a lot of stuff happens but also nothing at all."" This movie is one of the few that are canon in the series but if you expect it to be plot heavy then forget it. What it lacks in plot it makes up for in emotional depth that is expressed through the music and songs played. If you don't plan on watching the film then I recommend at least listening to the soundtrack on Spotify. It's fantastic! Our female lead Uta becomes a songstress for the world thanks to the short video clips of her singing she sends out andshe decides to hold her first-ever concert for her fans but it turns out that the once pirate-loving Uta has changed and the Strawhats and some surprising friends must save her and themselves before it's too late.

Simple enough plot. However, we see the Pirate Age from the eyes of civilians within the first few scenes of the film. We as the audience have seen things mainly from the perspective of our Strawhats and we know that most pirates aren't like them but for once we are transported to what the average pirate does to the ordinary citizen and that the marines aren't as useful in dealing with them. This is where we know our gang comes into play to fix the problems the marines have let rot. Unfortunately, there are more Blackbeards and not enough Luffys in the world to deal with all the problems the world is facing.

By telling the story through songs we get to understand how the characters are feeling. In this case, Uta sings through the progression of her own emotional development throughout the film, and in turn, we learn more about Luffy, Shanks, and Uta and what being a Pirate means through Uta's backstory. 

I think actions speak louder than words and just like in the Fishman Arc when Luffy told the citizens to determine for themselves whether he was a hero or villain, we as the audience have to determine the worth of this film not based on plot but emotion. 

Do you like music? Anime? Music in anime? Emotional depth? Character-driven stories? Decent action scenes? Then this movie is for you, even if you're not a One Piece fan. It's just nice to look at and listen to overall.",False,anime_review,50410,2022-11-20T16:52:00+00:00
"the movie was promising to be the best one piece movie ever but for me didn't make the real hype happen(it was worth to watch but not as i thought it would be) if i were the studio to create movie about shanks i would literally created and made shanks a protagonist of movie and start to show his journy after roger death and making his crew and some mysteries around him to make him even more mystery (even show his duel with mihawk to the audience.)in my opinion the whole purpose of the movie was just earning money from shanks name(we just barely seehim) why do you even make movie about him by luffy being the protagonist?
beside all this the ideas used in story were good but the outcome and executive weren't great.and the movie feeled a bit stampede time movie which we just see too many fights in all the scenes with zero effort to make a great sequence.

as a result

if you are shanks fan you won't be enough happy about seeing him maybe for his powers!!
if you are stamped type movie fan go watch it
if you are more story wise type of human like me i don't recommend it even though it did show us some tiny important details to discuss",False,anime_review,50410,2022-08-10T13:31:00+00:00
"It was actually a pretty weak story... and a lot of the 3d animation actually looked off... expensive, but off... But, that said, the songs were a banger, and while as a whole, the movie's story felt weak, many of the individual scenes felt okay and if you watched the filler episodes leading up to the movie, then it's enjoyable, seeing Luffy and Uta reunite. They actually had good chemistry.... Like, after Luffy meets again with Uta, it's basically just event after event.... not much build up, not much characterization... very little dialogue... The character introductions suck, the motivation feels weak and frankly, the conflictcomes out of nowhere.

Like, a lot of it works more because we knew so many of the characters from the main series....

But, while the songs are top notch and Uta was a great character, it's a weak movie... not one of the best...

That said, I recommend watching it. It's still an enjoyable experience for One Piece fans...

But note, it's not because it's a good movie but because it's something nice to watch, if that makes sense.",False,anime_review,50410,2022-09-11T01:02:00+00:00
"A lot of people are reviewing this based on what they wanted the movie to be, and not what the movie actually was, so let me give you a more honest review. Many of the people who disliked this movie seem to dislike it for it's lack of action packed scenes, but my favorite parts of One Piece are the interconnecting storylines and plot more so than the battles. This movie was never meant to be action only, nor was it marketed to be. It's about Luffy's childhood friend, a singer who made him want a muscian more than anything, and is literally named ""song,"" andit is set at her concert, so of course it was going to have more music and plot than fighting. 

There are also a lot of people complaing about Uta herself, which is, quite frankly, a travesty. I believe more people would have liked here had the movie been just a little longer, allowing for her story to be a little les rushed. I love to pull apart stories and do in depth character analysis, and Uta helps put together so many of the missing puzzle pieces of Luffy's back stroy. Yet that flies right over people's heads as they hate on Film Red for not being an action based movie. I would go off on my analysis of her, but I don'twantto include spoilers.

It's tragic and emotional, and we get to see some of the more human parts of Shanks, like in chapter one of the series.  It adds a lot to the depth of canon even though the main event of the movie isn't canon. Uta is though! It was confirmed by Oda and she appeears as a silohoutte in a more recent chapter, so from this, we can assume that at least the childhood things might be canon. Though I do believethat people should take canon vs non-canon a little less seriously and choose to have fun with it instead. 

I cried while in the theater. 

In short, I adore this movie and Uta. It's quickly become my favorite One Piece movie, and I doubt anything can replace it now. I'm incredibly happy with it even if there were small things I would change just too keep it form seeming so rushed on the reveals. Though the rushing wasn't even that bad, I just pay too much attention to that sort of thing.

10/10 I plan to buy it on disk.",False,anime_review,50410,2023-02-15T14:46:00+00:00
"I don't wanna admit but yes OP Red was not the best part in One Piece movies. The story was not solid, and even though I knew it was about Uta and Shanks and music, there was too much songs filled in the movie. Yeah, I liked the last 15-20 mins with all the action, and also watching couple of my likeable characters (Katakuri) coming back to screen. Apart from that, the first half was not much interesting. Can say, that One Piece Red is a one time watch, although they have done good job with the animation and OST. Story : 5/10 Animation : 7/10 Characters : 6/10 MyFinal Rating : 6/10",False,anime_review,50410,2022-10-08T11:34:00+00:00
I watched this movie at cinema and during the movie i wanted to cut it out and go off but i just waited the scene that everybody go to movie. Movie really boring if we compare it with other One Piece films it is minus terrible there is no good antagonist and story is weak just good music and cinematics nothing more. If i should talk about Gear 5th scene it is not as i expect it should be longer scene but Luffy transform to Gear 4th Snake man then attacking Uta while he is attacking he suddenly transform gear 5th and nobody recognize aboutit just spends 5 seconds and one moment. I gave it 7/10 cause of One Piece normal story not for movie.,False,anime_review,50410,2023-03-14T05:11:00+00:00
"This movie is pretty much a musical. There are bits of action, story and humor in between. Apart from the climax fight, this has no exhilarating action. I have given 1 or 2 stars extra just for the end fight. It has been a disappointing movie. The story (which was barely decent) has been underwhelmed by the huge array of songs. They could've built the character better. The connections between the characters could've been explored more to give depth. And it definitely needed more action/humor scenes.The previous one (Stampede) was the best of the series.
And this one is probably among the bottom rungs of One piece movies.",False,anime_review,50410,2023-03-15T17:40:00+00:00
"I feel like I got blue balls from this film. Don't get me wrong, overall I enjoy the movie, there's up and down and emotional roller coaster. Unfortunately as an One Piece movie, this was so anti-climatic. The story is far from the theme ""Pirate"" just your typical action shonen with a bit of musical here and there. It was a let down, personally I got more chills from watching clips of big fight of One Piece film on youtube than this film. But as a musical action movie, this is definitely a recommended one. They really did an amazing part on the musical aspect,the fight was great. The animation is definitely an eye candy (after Uta ofc), and the animation also really good. 
Even though we got couple of minutes of Shanks's power, it still left a big impression to the watchers. Uta's performance is definitely a SSS tier for me. 
In conclusion : 
1. If you want to watch this as a One Piece film, definitely not recommended. I rather choose to wait the Blue ray version of it. 
2. If you want to watch this as a standalone film (as a musical theme fan), this is a must watch.",False,anime_review,50410,2022-09-22T05:22:00+00:00
"Fun movie, but overall pretty underwhelming. Visuals and music is really good, Ado's singing really carries the movie. Everything else is just a mess though. The story is not very well written and there's a bunch of cameos from previous characters for no other reason than to have them there, they serve no purpose to the plot at all. It's fun sure, but doesn't make for a good movie. The episodes which give some ""backstory"" to Uta did little to nothing to impact my enjoyment of the movie at all so wouldn't worry about watching them before the movie. I enjoyed the movie and would giveit a 6/10 score on pure enjoyment alone, but unless you're a big One Piece fan I wouldn't go out of my way to watch it.",False,anime_review,50410,2022-11-17T17:26:00+00:00
"TLDR: Like arcane or the recent tekken animation - fanservice artwork, animation and choreography, stunning soundtracks, mid to bad story telling (feel free to fight me on this comparison lmao) I don't want to say much, but it's not worth watching really :/ I didn't want to know anything before the film, so I went in not knowing that is was a musical. That being said, the moment the first song played, I accepted it and tried to watch the film in a normal way but I couldn't. The story was all over the place. It was not compelling, barely related to shanks. It was an actionfanservicy, orgasmic music mess. 

Art/Animation - 9/10 (for the most part it was beautiful looking and animated)
Sound - 10/10 (sounded more like a concert, oh boy the music was loud!...I will be downloading the OSTs)
Characters - 5/10 (talking about movie-only characters. she was mid, her caretaker was mid too)
Plot/Overall cohesiveness - 0/10 (it just had no flow. the only thing that flowed was the action. the pacing and feel of it was so weird, it didn't feel like a movie. it felt like a school project writing-wise. also, as many have said, WHERE WAS SHANKS I WANTED MORE SHANKS)",False,anime_review,50410,2022-11-17T13:53:00+00:00
"I would rather to watch a concert than to watch this. Not worth the time and money. The Visual Effect and CGI is indeed great, but the song is just too much. The writers just magically cramped the movie so it fits 5-6 songs (literally a single album) in one movie. And then, in the end, they put 2 more ""sad theme"" song to baited audience's emotional after crappy one hour. Yeah, it's right, they ended literally song movie (I prefer to called it like that rather musical movie), with more SONGS with DIFFERENT EMOTION. So, literally minutes ago we got energetic happy song, andthen next we got furious rage song, and lastly we got ""forced"" sad song. My ear and brain is so confused, that I can't even laugh at 'marvel-like' jokes/comedy scene in-between songs.

It is also my fault, I didn't expect it to be song movie or musical movie or whatever. With the title ""RED"" - which I think about Red Hair Pirate, and it's not - and the gimmick ""Shanks' daughter"", I was expected to see more of Shanks' crew fight (they literally who saved the movie), but unluckily it didn't happen (it also makes me learn to read the synopsis carefully before watch any movies).

At the middle of 'awkwardly sitting in the dark' place for 2 hours-long most awaited movie, I realized, ""Yup, this movie is not for me.""",False,anime_review,50410,2022-09-22T03:51:00+00:00
