text,is_spoiler,source,mal_id,timestamp
"Well, le'ts just say that my father asked me if watching a movie from One Piece would give him an ideia about the story and characters and i (who is totaly lost in track about the series) just said that it would give him a hint about the vibe the series gives and well, he liked it. The man is not going to give the anime and it's 1.000 episodes a try but liked the pirates thing and for me, this counts. Heh. Not that i reccomend the movie but to someone that was lost in the Water Seven arc, seeing a lot of oldfaces brought me a certain joy.",False,anime_review,38234,2023-03-19T00:10:00+00:00
"This was definitely a good time. Got to show off much of the roster of characters, even if many of them didn't get much characterization and the entire idea that they come to this island all together feels a bit farfetched (and if they do, the absence of the Yonkou and several notable Shichibukai feels more than a little strange). Still, it's One Piece and not everything needs to make sense to have a good time. That being said, maybe it's just me being tired of this particular kind of villain, but ""very strong"" and ""has an independent streak"" just isn't enough characterization for me tobe interested. That might not be particularly fair, since the last One Piece movie I saw was Z, and Zephyr was the peak of One Piece movie villains. Still, Bullet is about as interesting as Shiki, which is to say that he has a history in the world that has some meaning, but that's about it. He's just an obstacle in the way of becoming Pirate King.

Still, this movie has a lot going for it. We get some really interesting team-ups, including a big fight involving all the Worst Generation and a rather disparate group of characters from every corner of the world that would never team up under other circumstances. It's nice to see how that latter team-up plays out, and though the former is fun, it feels largely just like a lesser version of their desperate fight against Kizaru in the main series. In all cases, though, the animation is dynamic and colorful. There's a lot to love about these fight scenes and how they amp them up - you can really see what led into the glory that is the Wano Arc. Probably its best moments, though, come from Usopp and Luffy themselves, though I won't spoil those. Overall, it's better than the average One Piece movie, but not as special as I was hoping to see.",False,anime_review,38234,2023-08-01T20:29:00+00:00
"I have to give credit for trying to craft a filler movie with as many well-known characters as possible, especially ones as richly developed as that of One Piece. However, rather then exploiting this angle for an incredibly engrossing star-studded story to match the scope of such a film, the creators have gone for a feature-length smack-down brawlfest featuring everyone vs. cliche’ filler villain. Why does he wanna beat the snot out of everyone? Who cares, watch! I have no problem with movies that want to be just one big (very long) fight. I absolutely loved the well-choreographed and stunningly animated Dragon Ball Super: Broly,which managed to be emotionally-involving underneath all the swinging fists and laser-beams. This time however, the devil was definitely not in the details. Important characters are pushed aside to do absolutely nothing important while others show up for a quick cameo and are then instantly shoved aside. It’s hard not to feel like this was a colossal waste of potential. Then again, there are probably some who would love nothing better than to see all their favorite characters go up against a big bad for 100 minutes. I just prefer a little meat to go with my gravy.",False,anime_review,38234,2022-03-30T22:00:00+00:00
"This movie is made entirely for One Piece fans. It is nothing but shameless fanservice from start to end and as a One Piece fan I liked this film, even though it’s impossible to miss some of its glaringly CG issues. I fell behind in One piece around volume 66 which means that I’m about 300 chapters behind where things are currently, but it’s One Piece so that shouldn’t matter too much. Once you have a basic understanding of the premise you can get the gist of what’s going on, it’s not exactly complicated. Some guys like each other, some guys don’t, the straw hats arethe main characters and Buggy the Clown is the most evil, vile, despicable villain in all of anime – no, all of cinema.

There really isn’t much else to say. This film was like 90% fighting a guy who’s really big and really bad. It’s full of callbacks, weird team ups, Usopp hype, Luffy hype and if hearing that 1st op be played again didn’t stir something inside you than its not too late to start. Start putting some bullets in your head-

7/10

This Review is actually the script to this video:

https://www.youtube.com/watch?v=UX_vvelkPh0

Check that out and subscribe to the channel if you want to see more reviews like it.",False,anime_review,38234,2022-04-05T08:10:00+00:00
"When I saw the poster I was very excited to see the movie, like I never had hope this big for an anime movie before, but turns out, this really disappointed me. Lacks protagonism, clickbait fanservice, absurd typical cliche antagonist. I really wish it was the Worst Gen vs Bullet, instead of some mixed random significant characters teaming up. And the characters portrayed still can't discover new ""techniques"" in their power etc (in combat meaning, idk if this makes sense). It's just inconsistent. And also I DESPISE the ending when Luffy crushed the laugh tale. The only good thing about this movie is animation, CGI,outfits design, and... yeah I think only that.

Overall: Waste of time. I think people only enjoy it because of the hype animation, CGI, fanservice, promotion vid and posters. The director and staff waste so many frames for annoying unnecessary fanservice.",False,anime_review,38234,2021-08-10T08:40:00+00:00
"Where do I begin? I'm probably extremely biased since One Piece is the air that I breathe, so keep that in mind when reading this review. This isn't exactly a movie that's purpose is to gather more fans either, it's more for current fans, what with all the older and smaller characters it brings in. I watched it in HD, so the art for me was just as good as some of top ranking One Piece films that came before this one. I saw some people didn't like the art or effects but I thought it was the same high quality as the other movies. Thecolors were vibrant, and it all seemed as high quality as one would expect from this kind of movie. I will say Gold and Z probably did understand how to contrast colors better to make scenes pop, so maybe that's where people were having trouble?

Sound was great, lot of great voice acting and music hit right where it was needed. Some kind of carnal joy is invoked from hearing the original opening theme when Luffy is kicking butt, words can't describe it.

I never expect a solid plot when watching an anime movie, but for critiquing purposes, the plot is about an 8 for me. It's not a full on 10, because the backstory for the villain isn't really developed and we only get one emotion from him throughout the movie. It would've been nice to see some of the other characters more included, and hearing their experiences when everything is going crazy. I'm lenient on deducting points for this, however, due to timing. It's a movie, and I doubt they want to make it two to three hours long. This isn't Lord of the Rings, or Avengers. The plot is constantly moving, always something happening to get it to the next scene, so it keeps you invested. Otherwise, the plot does its job, and I'm already a One Piece fan, so of course I'm going to watch it.

In terms of characters, I already know the characters, but if someone who doesn't know the characters tries to watch this movie, they may be confused, but I don't care. As far as I'm concerned, movies for popular anime aren't about bringing in new fans as much as servicing the current fans. I think they were all true to their character, and if you don't know who they are, tough luck, should probably watch the anime before the movie then.

Possible spoilers: *I thoroughly enjoyed the movie, there were plenty of moments that sped up my heart rate. It was interesting to see Luffy acting on a team outside his crew to defeat the main antagonist. It was a ragtag team that I love, and it's a really nice dynamic to experience. All the Easter eggs were great, seeing old characters in the background... I counted like 5 different Pandamen throughout the film. What truly brought me the greatest joy was seeing the Worst Generation acting in a movie. I love Kid, and I want to see more of him and his story. We'll have to wait and see what Oda has in store though.*

Overall, I thought the movie was outstanding, as it kept me interested and entertained throughout. Sure, plot and character development could've been more fleshed out, but I'm sure they didn't want to make it a long movie, so I'm not gonna nail them for it. Enjoyment was at all time high. I've already rewatched it due to how enjoyable it is.",False,anime_review,38234,2020-05-19T00:14:00+00:00
"Before saying anything bad about this movie, I gotta give credit to it first. I love how they included so many characters you havent seen for 100x episodes. The fight scences were looking very good, the overall animation as well. But, I didnt get the ""One Piece vibes"" from this movie. It was like a damn long fighting scene in my opinion. And because there were so many charcters, there was no screen time for any serious interactions between them. I had the feeling that they just wanted to throw as many characters as possible in there so you can attract many viewers. !SPOILER! For example, Luffy wasmeeting Sabo again, his brother he doesnt see often. The interactions were no longer than:
""Hey Sabo!""
""Hey Luffy!""
-End

This whole movie, Luffys just fighting Bullet, Sanji and Zoro out there for some little clashes that last a couple of seconds, but look dope. And the other strawhats ( except Ussop the GOD ) are just running around doing pretty much nothing.

!SPOILER END!

The Story was just poor, and I miss the typical ""One Piece adventure feeling"" in this movie. It was just a long decent fight, but it was still enjoyable. 
However, there are definetly better OP movies out there.

A decent enjoyable movie:
6/10!",False,anime_review,38234,2020-09-15T17:31:00+00:00
"Pretty disappointed in this movie, because I know One Piece can do better than this. The entire plot was just a sorry excuse to use every single character in the series without any explanation what so ever. In fact, most of them just straight up make no sense, why tf is Wapol here, isnt he a king again? And i am by no means an animation snob, but seriously, there is way to much terrible cgi animation to forgive. There is no comedy, and overall not much to enjoy about the movie other than the fanfare, which doesn't feel exciting because it has no lore to backit up.

If you are looking for a one-piece movie, go watch red or gold (gold is really really good)",False,anime_review,38234,2025-11-25T23:22:00+00:00
"Having a separate entry because of technicality rather than being what would most call an anime, these short clips are a public service announcement with One Piece characters. Visually it’s quite simple, one background for all of these shorts, and not much movement animation. It’s also very short, but that’s kinda given, being just and announcement. Content-wise, it’s a nice attempt to make normally boring infodumping a bit more entertaining. You also have to keep in mind that this is obviously aimed at the younger audience. I’m sure someone somewhere should object to One Piece characters being mouthpiece for unrelated announcements, but “wash your hands, sleepwell” isn’t any nefarious message to convey.

It’s really hard to judge this as an anime, but if judged as a PSA, it’s quite alright, better than most even. So, fine it is.",False,anime_review,51163,2022-03-07T02:38:00+00:00
"Very cute alignment of check-ins with the Strawhats, I appreciate this gesture from the animation studio, taking advantage of their platform and reach to spread awareness of this horrible virus. A true virtue that others should learn to apply. It was cool to see Chopper give actually real-world medical advice, although, it felt very weird to have Zoro give advice too, and Franky who's already a Cyborg as well, but the fact that he operated on himself and rebuilt almost his entire body must have taken a lot of medical knowledge, and oh, of course, the man already dead, Brook.",False,anime_review,51163,2022-05-08T12:36:00+00:00
"I don't know why MAL does it to us, introduce an entry so hard to find that you might instead dedicate your research time to solving world hunger (and probably would come up with positive results) and leave you there for months, sometimes years looking for a place to watch it with no hope. However, the satisfaction that follows finally marking something “completed” keeps you being for this guilty pleasure low form of torture. On a personal note, the poster assigned to this short does not do this animation justice, it gives off the vibes of some generic PS2 low-budget movie which isn't necessarily far from thetruth, however, the unique One Piece atmosphere fills every nanometer of the presented environment. The classic One Piece humor all over the place, the crazy over the top cartoonish designs, and the throwaway side plot that only serves as a presentaétion device for the whole magical adventure.",False,anime_review,12001,2021-01-11T06:46:00+00:00
"ok, for a short little animation like this, it wasn't that bad. It revolves around the strawhats being attacked by marines and going through some weird coral thing with layers and traps, from arrows to baseball marines (LAWL) they have it all. it introduced some cool concepts as well as characters (mainly the marine's and the baseball marines) it was somewhat enjoyable to watch, I didn't enjoy it because its 3d, and has god awful animation and camera movement. The animation is like runescape LOL overall i would rate this a 7 only because I enjoy watching these random ass entry's. But yea, the anamation sucks booty.",False,anime_review,12001,2021-11-20T22:30:00+00:00
"Watched after One Piece 3D: Straw Hat Chase Did not expect this to be the return of the Kung Fu Dugongs but I am here for it, very similar with my last watch in how it would have been so much better if I could have watched it in 3D. This short film is only 10 minutes and uses way more 3D techniques which makes the film very cramped. It was difficult to find out what this was made for but it leads towards a similar kind of roller coaster as a promotional material for it rather than just a random short film. The film was funand easy to watch but still ugly art and lack of story (which is fair considering One Piece taking 50 eps to make a short story rather than the 10 minutes that they had for this).",False,anime_review,12001,2024-12-01T16:57:00+00:00
"Enjoyable, Emotional, Engaging and the type of movie where you can't help but smile while watching. It is narratively quite unique in comparison to other one piece films but it showcased the ability to highlight the character of Uta and the magical world of film red to a perfect level while also being able to combine many elements of what we love about one piece such as the same enjoyable cast as usual, occasional nice comedic bits, great fight scenes, scenes that are hype , scenes that are emotional and a nice setting and moments which make you grateful to be a fan ofthe series. 

A pretty significant direction style that can be noticed is the large amount of music present in the movie and how ""music-based"" it is. In many cases, it can be a fair point that an incredibly large amount of seven songs is too much but the way Film Red is directed and presented, this would be far from the truth because the music is not only a key part of Uta but the movie as a whole.  Everything was paced to a good level and there were never those moments where you are awkwardly staring at the screen wondering ""what is even going on?"".  Due to the fact that it is connected to a full anime series, It is also naturally done in a way for one piece fans to enjoy it. It is a one piece movie after all so it makes sense for the target audience to be big fans of this series. 

When it came to the peaks and the ending moments, Film Red knew how to do it. 



In terms of Art and Animation, it can be a extremely fair statement to say it is the best one piece movie when it comes to it. There is some CGI in some bits here and there but that's about the most that can be criticized because almost everything is perfect visually. Every fight scene looks incredible, the art style and top tier animation is not only beautiful but consistent throughout the movie and it undoubtedly is one very strong point out of many strong points that Film Red has to offer.


Music Wise, It is one of the easiest 10/10's I will ever give. Maybe even the easiest ever. Like said earlier, Music is a crucial part of the story and Film Red does this perfectly. There are seven songs in the movie all sung by the fantastic Ado. Once again.. SEVEN songs. Which is a pretty large amount when it comes to songs used in a movie. With that said, it might be assumed there would be one song that's not so good. This is not the case because although music is subjective, each song was quite perfect for the scene they played in, the role it had in the movie and how it contributed. I am actually a big fan of Ado and her music, so music-wise it was as perfect as it could possibly get. There was even an interview where it stated there was supposed to be an audition for the singing voice of Uta but when Ado showed up, the audition was ended because everyone quickly knew Ado would be the one. And they were right. Because it couldn't have been better. 

Even outside of Ado's fantastic vocals, many great artists and producers were also part of the music and it's a list that includes names such as Yasutaka Nakata, Mrs. Green Apple , Vaundy, Fake Type., Yuta Orisaka, Motohiro Hata and the great Hiroyuki Sawano.
The people working on Film Red understood the significance of music in the movie perfectly and it showed. 


Character Wise, Uta and Shanks would of course be the main talking points and Uta specifically was a great presence in the movie. She was likable, intriguing backstory, her voice actor and the singing voice were perfect, has a great character design and has links to a classic beloved character. She had lots of focus in the movie and her character arc from start to finish was handled quite well.  Shanks is obviously the poster boy of the movie and thankfully, getting to see Shanks with more than 1 minute of screen time was a joy.  When I first saw promotional posters and character images, I was initially afraid there would be too many characters and too many that do nothing and add nothing and don't get that much screen time compared to what we may have expected. To be completely honest, there are actually characters that may fall under that definition but it is nothing major enough to be considered a big flaw or anything that kills off enjoyment. More importantly, the major characters that had significance in the movie all shined and had their memorable moments. 


Ultimately, it is a film that can be enjoyed by many and shows quality in many forms whether it be the visuals, it's premise, the songs and the fact that it is a one piece movie like no other and although advertised and is pretty much non-canon, it does have links and large hints to canon information for the future. A memorable experience and a whole lot of fun to watch from start to finish.",False,anime_review,50410,2022-08-08T01:28:00+00:00
"First off, I would like to acknoledge the fact this is a non-canon movie althought we will get back to this. It's non canonness doesn't change the fact that, althought being a movie that doesn't inscribe in any timeline, it's still pretty incoherent. The movie is a huge purge to watch and I have seen a lot of people online stating that this is an incredible movie, they should use those words more carefully. This movie has a lot of objective flaws that are not my opinion that are simply made here to attract the fans. At out the way, I would like to talk aboutthe good part of this movie. Some of the songs are great. UTA's singer does a pretty good job. She sings pretty well and some of the songs are a BOP. BUT, most of the songs are those kind of ""disney princess"" song where the caracter just talk about her fellings and it's really cliche.

Now that i talked about what I liked, let's talk about what's not to like in this movie. And for a movie starring Shanks, It was clear that there would be some fan service, but damn. This is my main issues with the movie. It has numerous, to say the least, fan service that are for most, caracters doing cameos. We have caracters taking part in the film that are neither pertinent nor justified. The movie has plenty of caracters that are like this. It is clearly made just to attract the fan boys and nothing else. You can seriously wipe out half the cast and the movie doesn't change. It's like the infinity war of one piece but not in a good way. You also have elements that are still not in the anime nor the manga that appair in the movie. It's just here to spoil the anime and this not good at all. 

Also, another thing you can add that's pretty funny. One Piece's (the anime) biggest flaw is it's pacing. And right here the pacing is horrible. Everything happen really fast and you have things just coming out of everywhere. For the first hour, you just altenate beetween UTA singing and the lore of the island being explained to you. So you have all of these caracters that are completely disconected with the events that come here and just explain the lore and then she starts singing again. And another one comes and then she sings again. The ending happens also so fast you don't see it coming, not in a good way of course.

Furthermore, the guys who wrote this should be ashamed. (it might be like my review) They should of reread the things they wrote because most of it is so bad, even a 5 year old kid would of done something better. It was  really really bad. You have a bid deus ex machina. Characters that had no intoduction that just pop out of nowhere to save the situation. There is also a plot twist that completely ruins the movie by the end. 

The animation was also a big question for me. Sequences are action are just the caracters throwing their main signature attacks and that's all there is for the combat. No choregraphy, no movement except maybe for one scene. There is tho two characters who got some fire animation : Jimbei and Brook. But why them ???

And when you thought I was done talking about the flaws. There was a promess of Shanks being developed. And I'm sorry but Shanks is more developed in the trailer than in the actual movie. The only character in the movie that get's a tiny bit of developement is UTA and it's pretty bad. She transforms from a cliche girl that sings and is just nice, to a danganronpa character. She starts doing some wacky face and some weird poses it's random. Her developement is just really cliche. The writers clearly took no risk it was really a shame.

And I could go on and on with this movie. The 2/10 is more than justified. If I was a One Piece fan, I would be embarrased. ""New Gen"" Toei animation is really lazy and cares more about the money they can found in your pocket that in the work they can put out. I suggest you don't watch this movie, especially if you are not up to date on the latest scan because it does spoil some things for you. You can always watch this movie later. But even so, the writing is straight up bad and lazy and really the only thing you will find out of this movie is just a warmed up fan service from the One Piece ""saga""",False,anime_review,50410,2022-08-11T16:04:00+00:00
